{
  "$schema":"https://json-schema.org/draft/2020-12/schema","$id":"https://opace.example/schemas/method-manifest-1.0.json","title":"BENCH-10 method manifest","type":"object","additionalProperties":false,"required":["schema_version","manifest_id","manifest_version","methods"],
  "properties":{"schema_version":{"const":"1.0"},"manifest_id":{"$ref":"#/$defs/id"},"manifest_version":{"pattern":"^[0-9]+\\.[0-9]+\\.[0-9]+$"},"methods":{"type":"array","minItems":1,"items":{"type":"object","additionalProperties":false,"required":["method_id","version","category","classification","adapter","native_score_semantics","threshold_provenance","minimum_input_bytes","maximum_input_bytes","route","repeat_count","candidate_budget","network_behaviour","provider_terms_approval_reference","licence_record_id","model_record_id","data_record_id"],"properties":{"method_id":{"$ref":"#/$defs/id"},"version":{"type":"string","minLength":1,"maxLength":80},"category":{"enum":["deterministic_core","synthetic_control","detector","watermark","rewrite"]},"classification":{"enum":["direct","mock","local","public_fixture"]},"adapter":{"enum":["core_inspect","synthetic_matrix"]},"native_score_semantics":{"type":"string","minLength":3,"maxLength":300},"threshold_provenance":{"type":"string","minLength":3,"maxLength":300},"minimum_input_bytes":{"type":"integer","minimum":0},"maximum_input_bytes":{"type":"integer","minimum":1,"maximum":250000},"route":{"const":"browser"},"repeat_count":{"type":"integer","minimum":1,"maximum":20},"candidate_budget":{"type":"integer","minimum":0,"maximum":20},"network_behaviour":{"const":"none"},"provider_terms_approval_reference":{"type":["string","null"],"maxLength":120},"licence_record_id":{"$ref":"#/$defs/id"},"model_record_id":{"type":["string","null"],"maxLength":80},"data_record_id":{"type":["string","null"],"maxLength":80}}}}},"$defs":{"id":{"type":"string","pattern":"^[A-Za-z][A-Za-z0-9_.-]{2,79}$"}}
}
