{"schema_version":"1.0","manifest_id":"methods_synthetic_mechanics","manifest_version":"0.1.0","methods":[{"method_id":"opace_core","version":"2026.08.1","category":"deterministic_core","classification":"public_fixture","adapter":"core_inspect","native_score_semantics":"Canonical deterministic state only; no authorship probability.","threshold_provenance":"No statistical threshold; named deterministic rules.","minimum_input_bytes":0,"maximum_input_bytes":250000,"route":"browser","repeat_count":1,"candidate_budget":0,"network_behaviour":"none","provider_terms_approval_reference":null,"licence_record_id":"opace_mit","model_record_id":null,"data_record_id":"opace_synthetic_2026_08"},{"method_id":"synthetic_matrix","version":"0.1.0","category":"synthetic_control","classification":"mock","adapter":"synthetic_matrix","native_score_semantics":"Deterministic control state selected by opaque fixture sequence; never a provider result.","threshold_provenance":"Test matrix only; no threshold or product claim.","minimum_input_bytes":0,"maximum_input_bytes":250000,"route":"browser","repeat_count":2,"candidate_budget":2,"network_behaviour":"none","provider_terms_approval_reference":null,"licence_record_id":"opace_mit","model_record_id":null,"data_record_id":"opace_synthetic_2026_08"}]}
